tech_id,level_id,question_text,option_a,option_b,option_c,option_d,correct_option
11,2,What does the CSS rule border-collapse:collapse do?,Merges adjacent table borders into a single border.,Creates space between borders.,Increases the border width.,Collapses the border into the table content.,Merges adjacent table borders into a single border.
11,2,How do you apply a shadow to text in CSS?,text-shadow:,font-shadow:,text-outline:,box-shadow:,text-shadow:
11,2,Which CSS property allows you to set an image as the background of an element?,background-image:,background-url:,background-position:,background-style:,background-image:
11,2,How do you prevent an element from being selected in CSS?,user-select:none;,select:none;,text-selection:none;,hover:none;,user-select:none;
11,2,Which property defines the space between words in a text?,word-spacing,line-spacing,letter-spacing,text-spacing,word-spacing
11,2,Which CSS property is used to change the style of list markers?,list-style-type:,list-marker:,list-decoration:,marker-style:,list-style-type:
11,2,Which property is used to set the layout of table rows and columns?,table-layout:,display:table;,grid-layout:,row-column:,table-layout:
11,2,How do you create a fixed width for an element in CSS?,width:300px;,height:300px;,min-width:300px;,max-width:300px;,width:300px;
11,2,Which property controls the order in which grid items are placed?,grid-template-areas:,grid-auto-flow:,grid-row-gap:,grid-column-start:,grid-auto-flow:
11,2,Which property controls how a background image is repeated?,background-repeat:,background-position:,background-size:,background-attachment:,background-repeat:
11,2,Which property sets the width of an element relative to its container?,width:100%,max-width:100%,min-width:100%,container-width:100%,width:100%
11,2,Which property is used to control the layout direction of flex items?,flex-direction:,align-items:,justify-content:,align-content:,flex-direction:
11,2,Which CSS property is used to control the visibility of an element?,visibility:,display:,opacity:,z-index:,visibility:
11,2,How do you specify the stacking order of elements?,z-index:,stack-order:,layer-order:,position-order:,z-index:
11,2,Which CSS property would you use to add space around images?,margin,padding,border-spacing,outline,margin
11,2,How do you apply a linear gradient as a background in CSS?,background:linear-gradient(color1, color2);,background-color:linear-gradient(color1, color2);,background-image:gradient-linear(color1, color2);,gradient:background(color1, color2);,background:linear-gradient(color1, color2);
11,2,Which CSS property defines the space inside the border of an element?,padding,border-spacing,margin,content-spacing,padding
11,2,What is the default display value of a <div> element?,block,inline,flex,none,block
11,2,Which property controls the appearance of table borders?,border-collapse:,border-width:,border-style:,table-border:,border-collapse:
11,2,Which value of the background-repeat property stops an image from repeating?,no-repeat,repeat-x,repeat-y,space,no-repeat
11,2,What is the default value of the flex-wrap property?,nowrap,wrap,wrap-reverse,none,nowrap
11,2,Which CSS property is used to control the overflow of text?,overflow:,text-overflow:,overflow-wrap:,text-wrap:,text-overflow:
11,2,Which CSS function is used to skew an element?,skew(),transform(),rotate(),translate(),skew()
11,2,How do you make an element transparent without hiding it?,opacity:0.5;,visibility:hidden;,display:none;,filter:transparent;,opacity:0.5;
11,2,Which CSS property is used to make text bold?,font-weight,bold-style,font-style,text-weight,font-weight
11,2,Which CSS property controls the line height of text?,line-height,font-size,line-spacing,text-spacing,line-height
11,2,Which value of the display property makes an element invisible but keeps it in the layout?,visibility:hidden;,display:none;,opacity:0;,z-index:-1;,visibility:hidden;
11,2,How do you prevent an element from floating?,clear:both;,float:none;,overflow:hidden;,display:block;,clear:both;
11,2,Which CSS property sets the distance between a flex container's items and its edges?,padding,margin,flex-gap,align-content,padding
11,2,What does the CSS property word-break do?,It specifies how words should break when reaching the end of a line.,It changes the word spacing.,It controls the hyphenation of words.,It controls the letter spacing.,It specifies how words should break when reaching the end of a line.
11,2,Which CSS property controls the size of the gap between grid columns?,column-gap:,grid-gap:,column-spacing:,grid-column:,column-gap:
11,2,What does the CSS property white-space control?,It specifies how white space inside an element is handled.,It changes the color of white space.,It removes the white space between elements.,It adds extra padding around the text.,It specifies how white space inside an element is handled.
11,2,Which CSS property is used to center content horizontally in a flex container?,justify-content:center;,align-items:center;,align-self:center;,align-content:center;,justify-content:center;
11,2,Which CSS property controls the flow of content in a multi-column layout?,column-fill,column-gap,column-span,column-direction,column-fill
11,2,Which CSS property would you use to set a background image that does not scroll with the page?,background-attachment:fixed;,background-scroll:none;,background-fixed:,background-repeat:none;,background-attachment:fixed;
11,2,Which CSS property controls the indentation of the first line of a block of text?,text-indent:,text-indentation:,margin-left:,padding-left:,text-indent:
11,2,How do you make a list display horizontally in CSS?,list-style: inline;,display: inline-block;,flex-direction: row;,display: inline;,display: inline-block;
11,2,Which CSS property defines the maximum height of an element?,max-height:,height:,max-size:,line-height:,max-height:
11,2,What is the purpose of the CSS calc() function?,To perform calculations on CSS property values,To calculate grid gaps automatically,To adjust font size based on screen resolution,To calculate margin and padding,To perform calculations on CSS property values
11,2,Which property defines the space between an element's border and its surrounding elements?,margin:,padding:,border-spacing:,border-width:,margin:
11,2,What is the use of the float property in CSS?,It allows elements to float to the left or right of their container.,It controls the position of background images.,It defines whether an element will be displayed inline or block.,It sets the height of an element.,It allows elements to float to the left or right of their container.
11,2,How do you apply styles to the first child of an element?,:first-child,p:first-child,element:first-child,:nth-child(1),:first-child
11,2,Which CSS property allows an element to stretch to fit its parent container?,width:100%,max-width:100%,min-width:100%,display:block,width:100%
11,2,What does the :focus pseudo-class in CSS do?,Applies styles when an element is focused,Applies styles when an element is clicked,Applies styles when an element is hovered,Applies styles when an element is selected,Applies styles when an element is focused
11,2,Which CSS property is used to define the space between the lines of text?,line-height,letter-spacing,text-spacing,word-spacing,line-height
11,2,What does the CSS float property control?,It controls whether an element should float to the left or right.,It controls whether an element is visible or hidden.,It controls the background size.,It controls the text color.,It controls whether an element should float to the left or right.
11,2,How do you make an element a flex container?,display:flex;,flex-container:,flex:1;,display:block;,display:flex;
11,2,Which CSS property is used to control the display of a table's borders?,border-collapse:,border-style:,border-width:,border-spacing:,border-collapse:
11,2,What does the letter-spacing property control?,The space between characters,The space between words,The space between lines of text,The space between paragraphs,The space between characters
11,2,How do you make text all uppercase in CSS?,text-transform:uppercase;,font-case:uppercase;,text-format:uppercase;,letter-case:uppercase;,text-transform:uppercase;
11,2,Which CSS property is used to change the cursor when hovering over an element?,cursor:,hover-cursor:,pointer-cursor:,mouse-pointer:,cursor:
11,2,How do you apply a radial gradient as a background in CSS?,background:radial-gradient(color1, color2);,background-color:radial-gradient(color1, color2);,background-image:radial-gradient(color1, color2);,gradient:radial-background(color1, color2);,background:radial-gradient(color1, color2);
11,2,Which CSS property is used to set the minimum height of an element?,min-height:,height:,max-height:,min-size:,min-height:
11,2,How do you apply a background image only once in CSS?,background-repeat:no-repeat;,background:no-repeat;,background-image:no-repeat;,image-repeat:none;,background-repeat:no-repeat;
11,2,Which CSS property controls how a background image is positioned?,background-position:,background-size:,background-clip:,background-repeat:,background-position:
11,2,What is the purpose of the overflow property in CSS?,It specifies what happens if content overflows an element's box.,It sets the maximum width of an element.,It controls how background images are displayed.,It adjusts the spacing between elements.,It specifies what happens if content overflows an element's box.
11,2,Which CSS property is used to underline text?,text-decoration:,text-transform:,font-style:,text-align:,text-decoration:
11,2,What is the purpose of the :nth-child() pseudo-class in CSS?,It applies styles to elements based on their position within a parent element.,It applies styles to the last child of an element.,It selects elements based on their class.,It applies styles to the first child of an element.,It applies styles to elements based on their position within a parent element.
11,2,Which CSS property is used to create space between the border of an element and its content?,padding:,margin:,border-spacing:,border-width:,padding:
11,2,What is the default value of the display property for a <div> element?,block:,inline:,inline-block:,flex:,block:
11,2,How can you center an element horizontally with CSS?,margin: auto;,text-align: center;,display: flex;,position: absolute;,margin: auto;
11,2,What is the purpose of the z-index property in CSS?,It controls the stacking order of elements.,It defines the size of an element.,It changes the font color.,It sets the visibility of an element.,It controls the stacking order of elements.
11,2,Which CSS property is used to change the font size of text?,font-size:,text-size:,font-weight:,text-style:,font-size:
11,2,How do you create a CSS transition effect?,transition: property duration;,animation: property duration;,effect: property duration;,transition-effect:;,transition: property duration;
11,2,Which property is used to control the visibility of an element?,display:,visibility:,opacity:,hidden:,visibility:
11,2,What does the `overflow: hidden;` property do?,It hides any content that overflows the element's box.,It shows all content.,It makes the content scrollable.,It adjusts the height of the element.,It hides any content that overflows the element's box.
11,2,How do you make an element responsive using CSS?,Use media queries;,Use fixed dimensions;,Use percentages for widths;,Use viewport units;,Use media queries;
11,2,Which property is used to create rounded corners in CSS?,border-radius:,corner-radius:,rounded-corners:,border-style:,border-radius:
11,2,What is the function of the `position: absolute;` property?,It positions an element relative to its nearest positioned ancestor.,It sets the element at a fixed position.,It positions the element at the top left corner.,It positions an element relative to the viewport.,It positions an element relative to its nearest positioned ancestor.
11,2,How do you hide an element in CSS without removing it from the document flow?,visibility: hidden;,display: none;,opacity: 0;,position: absolute;,visibility: hidden;
11,2,Which CSS property changes the color of text?,color:,text-color:,font-color:,text-style:,color:
11,2,How can you create a vertical navigation menu with CSS?,Use float:left;,Use display:inline-block;,Use flexbox;,Use grid;,Use flexbox;
11,2,What does the `display: flex;` property do?,It creates a flexible box layout for its children.,It makes elements inline.,It sets elements as block-level.,It centers the content.,It creates a flexible box layout for its children.
11,2,How do you style visited links differently from unvisited links?,Use the :visited pseudo-class;,Use the :active pseudo-class;,Use the :hover pseudo-class;,Use JavaScript;,Use the :visited pseudo-class;
11,2,What is the purpose of the `box-shadow` property in CSS?,It adds shadow effects around an element's box.,It defines the border of an element.,It sets the background color.,It adjusts the text size.,It adds shadow effects around an element's box.
11,2,Which property is used to set the background color of an element?,background-color:,color:,bg-color:,background:,background-color:
11,2,How do you create a CSS grid layout?,display: grid;,display: flex;,display: block;,display: inline-block;,display: grid;
11,2,What is the purpose of the `clear` property in CSS?,It specifies whether an element can be next to floating elements.,It defines the size of an element.,It sets the background color.,It controls visibility.,It specifies whether an element can be next to floating elements.
11,2,Which CSS property defines how the content of an element should overflow?,overflow:,display:,visibility:,position:,overflow:
11,2,How do you change the background color of an element when hovering over it?,element:hover { background-color: color; },element:focus { background-color: color; },element:active { background-color: color; },element:visited { background-color: color; },element:hover { background-color: color; };
11,2,What does the `opacity` property do in CSS?,It controls the transparency level of an element.,It sets the position of an element.,It defines the color of an element.,It adjusts the border width.,It controls the transparency level of an element.
11,2,How do you apply multiple classes to an element in HTML?,class="class1 class2",class="class1,class2",class1, class2,class1; class2;,class="class1 class2";
11,2,Which property controls the width of an element's border in CSS?,border-width:,border-size:,border-style:,border-color:,border-width:
11,2,What does the `visibility: hidden;` property do?,It makes an element invisible but still occupies space.,It removes an element from the document.,It shows the element.,It adjusts the height of the element.,It makes an element invisible but still occupies space.
11,2,Which CSS property is used to define the style of list items?,list-style-type:,list-style:,list-type:,list-style-position:,list-style-type:
11,2,How do you create a fixed navigation bar with CSS?,Use position: fixed;,Use display: inline;,Use float: left;,Use position: absolute;,Use position: fixed;
11,2,What does the `font-weight` property control?,It defines the thickness of the text.,It sets the font style.,It controls the font size.,It adjusts the spacing of letters.,It defines the thickness of the text.
11,2,How can you hide the scrollbar of an element?,overflow: hidden;,overflow: scroll;,overflow: auto;,overflow-y: hidden;,overflow: hidden;
11,2,Which property is used to set the height of an element?,height:,max-height:,min-height:,size:,height:
11,2,What does the `:hover` pseudo-class do in CSS?,It applies styles when the user hovers over an element.,It applies styles when the element is active.,It applies styles when the element is clicked.,It applies styles when the element is focused.,It applies styles when the user hovers over an element.
11,2,How do you apply a CSS style to every odd child of an element?,element:nth-child(odd) { },element:nth-child(2n+1) { },element:odd { },element:first-child(odd) { },element:nth-child(2n+1) { };
11,2,Which CSS property is used to create space between elements?,margin:,padding:,spacing:,border-spacing:,margin:
11,2,What is the purpose of the `flex-wrap` property in CSS?,It defines whether flex items should wrap onto multiple lines.,It sets the direction of flex items.,It adjusts the spacing between items.,It defines the order of flex items.,It defines whether flex items should wrap onto multiple lines.
11,2,How do you change the text color of all paragraphs on a page?,p { color: color; },all p { color: color; },paragraph { color: color; },p.color { },p { color: color; };
11,2,Which property is used to set the display style of an element to inline-block?,display: inline-block;,display: block;,display: inline;,display: flex;,display: inline-block;
11,2,What does the `border-collapse` property do in CSS?,It specifies whether table borders should collapse into a single border.,It defines the width of borders.,It sets the style of borders.,It adjusts the spacing of borders.,It specifies whether table borders should collapse into a single border.
11,2,Which property defines how an element is aligned vertically within a flex container?,align-items:,justify-content:,flex-align:,align-content:,align-items:
11,2,How do you make an element take up the full width of its parent container?,width: 100%;,width: auto;,width: inherit;,display: block;,width: 100%;
11,2,What does the `text-align` property do?,It sets the horizontal alignment of text within an element.,It defines the size of text.,It sets the line height of text.,It adjusts the color of text.,It sets the horizontal alignment of text within an element.
11,2,How do you make an element fixed at the top of the page?,position: fixed; top: 0;,position: absolute; top: 0;,display: fixed; top: 0;,position: sticky; top: 0;,position: fixed; top: 0;
11,2,Which property is used to control the spacing between words in text?,word-spacing:,letter-spacing:,line-height:,text-spacing:,word-spacing:
11,2,What is the purpose of the `position: sticky;` property in CSS?,It allows an element to "stick" to a specific position when scrolling.,It sets the position of an element relative to its nearest positioned ancestor.,It creates a fixed position.,It makes an element static.,It allows an element to "stick" to a specific position when scrolling.
11,2,How do you define a CSS variable?,--variable-name:,var(variable-name);,CSS-variable: variable-name;,variable: variable-name;,--variable-name:
11,2,Which property is used to control the display of an element?,display:,visibility:,opacity:,show:,display:
11,2,What does the `@media` rule do in CSS?,It applies styles based on the media type or device.,It imports styles from another stylesheet.,It defines keyframes for animations.,It sets the background image.,It applies styles based on the media type or device.
11,2,How can you create a transition effect when changing the background color of an element?,transition: background-color 0.5s;,transition: color 0.5s;,transition: all 0.5s;,transition: background 0.5s;,transition: background-color 0.5s;
11,2,What property is used to change the cursor style when hovering over an element?,cursor:,pointer:,hover:,mouse:,cursor:
11,2,How do you add a shadow to text in CSS?,text-shadow: x-offset y-offset blur color;,box-shadow: x-offset y-offset blur color;,shadow: x-offset y-offset blur color;,text-shadow: color x-offset y-offset;,text-shadow: x-offset y-offset blur color;
11,2,What does the `align-self` property do in CSS?,It overrides the `align-items` property for a specific flex item.,It aligns all flex items.,It sets the position of an element.,It defines the width of an element.,It overrides the `align-items` property for a specific flex item.
11,2,Which CSS property is used to change the line height of text?,line-height:,text-height:,height:,line-size:,line-height:
11,2,How do you create a CSS class?,.classname { property: value; },classname: property: value;,class: classname { property: value; },classname: { property: value; },classname { property: value; };
11,2,What is the purpose of the `background-image` property in CSS?,It sets an image as the background of an element.,It defines the color of the background.,It sets the size of an image.,It controls the opacity of an image.,It sets an image as the background of an element.
11,2,How can you create a hover effect that changes the size of an element?,element:hover { transform: scale(1.1); },element:hover { size: larger; },element:hover { width: 110%; height: 110%; },element:hover { scale: 1.1; },element:hover { transform: scale(1.1); };
11,2,What does the `text-transform` property do in CSS?,It controls the capitalization of text.,It sets the font style.,It defines the size of text.,It adjusts the spacing of letters.,It controls the capitalization of text.
11,2,How do you make a background image cover the entire element?,background-size: cover;,background-size: contain;,background-repeat: no-repeat;,background-position: center;,background-size: cover;
11,2,Which property is used to create space inside an element?,padding:,margin:,spacing:,border-spacing:,padding:
11,2,What does the `grid-template-columns` property do in CSS?,It defines the number and size of columns in a grid layout.,It sets the size of rows.,It creates a flex layout.,It positions grid items.,It defines the number and size of columns in a grid layout.
11,2,How do you center an element vertically within its parent?,Use flexbox or grid;,Use absolute positioning;,Use margin:auto;,Use text-align:center;,Use flexbox or grid;
11,2,Which property controls the background color of an element?,background-color:,bg-color:,color:,background:,background-color:
11,2,What does the `filter` property do in CSS?,It applies graphical effects like blur or brightness to an element.,It changes the position of an element.,It adjusts the size of an element.,It sets the visibility of an element.,It applies graphical effects like blur or brightness to an element.
11,2,How do you create a dashed border in CSS?,border: 1px dashed color;,border: 1px dotted color;,border-style: dashed;,border-color: color;,border: 1px dashed color;
11,2,What does the `flex-direction` property control?,It sets the direction of flex items in a flex container.,It defines the alignment of flex items.,It adjusts the size of flex items.,It controls the wrapping of flex items.,It sets the direction of flex items in a flex container.
11,2,How can you hide an element visually but still keep it accessible to screen readers?,visibility: hidden;,position: absolute; left: -9999px;,display: none;,opacity: 0;,position: absolute; left: -9999px;
11,2,Which property is used to set the transition duration in CSS?,transition-duration:,transition-time:,duration:,time:,transition-duration:
11,2,What does the `text-decoration` property control?,It sets decorations on text, such as underline or strikethrough.,It controls the alignment of text.,It adjusts the font size.,It changes the background color.,It sets decorations on text, such as underline or strikethrough.
11,2,How do you change the cursor to a pointer when hovering over a link?,cursor: pointer;,cursor: hand;,cursor: move;,cursor: url('pointer.png');,cursor: pointer;
11,2,Which property is used to control the font style of text?,font-style:,text-style:,font-color:,font-weight:,font-style:
11,2,What is the purpose of the `max-width` property in CSS?,It sets the maximum width an element can be.,It defines the minimum width.,It controls the width of an element.,It sets the size of the element.,It sets the maximum width an element can be.
11,2,How can you create a CSS rule that targets only the last child of an element?,element:last-child { },element:last { },element:final-child { },element:last-child-of { },element:last-child { };
11,2,Which property defines the number of lines in a flexible box layout?,flex-wrap:,flex-direction:,flex-basis:,flex-flow:,flex-wrap:
11,2,What does the `box-sizing` property do in CSS?,It alters the default CSS box model.,It sets the dimensions of an element.,It defines the position of an element.,It controls the margin of an element.,It alters the default CSS box model.
11,2,How do you create a responsive font size using CSS?,font-size: calc(1vw + 1em);,font-size: responsive; font-size: auto;,font-size: fit-content;,font-size: fluid;,font-size: calc(1vw + 1em);
11,2,Which property controls the space between rows in a grid layout?,grid-row-gap:,grid-column-gap:,grid-gap:,row-spacing:,grid-row-gap:
11,2,What is the purpose of the `transform` property in CSS?,It applies a transformation to an element.,It changes the color of an element.,It sets the position of an element.,It defines the width of an element.,It applies a transformation to an element.
11,2,How do you set the border of an element to be solid?,border: 1px solid color;,border: solid color;,border: 1px dashed color;,border-style: solid;,border: 1px solid color;
11,2,What does the `flex-grow` property do?,It defines the ability of a flex item to grow if necessary.,It sets the height of a flex item.,It controls the width of a flex item.,It defines the alignment of flex items.,It defines the ability of a flex item to grow if necessary.
11,2,How do you style an active link in CSS?,a:active { color: color; },a:hover { color: color; },a:focus { color: color; },a:active { background-color: color; },a:active { color: color; };
11,2,What does the `line-height` property control?,It defines the height of a line box.,It sets the font style.,It adjusts the text color.,It defines the width of an element.,It defines the height of a line box.
11,2,Which property is used to create a multi-column layout in CSS?,column-count:,multi-column:,columns:,column-style:,column-count:
