tech_id,level_id,question_text,option_a,option_b,option_c,option_d,correct_option
11,2,Which CSS property controls the text size?,font-size,font-weight,font-style,font-variant,font-size
11,2,Which CSS property is used to change the background color?,background-color,color,background-image,border-color,background-color
11,2,Which CSS property is used to align text horizontally?,text-align,vertical-align,text-justify,text-decoration,text-align
11,2,What is the default value of the position property?,static,relative,absolute,fixed,static
11,2,Which CSS property is used to create space around elements?,margin,padding,border,spacing,margin
11,2,Which CSS property defines the space between the element's border and its content?,padding,margin,border,spacing,padding
11,2,Which property is used to control the order of stackable elements?,z-index,order,stacking,position,z-index
11,2,Which CSS function is used to rotate an element?,rotate(),transform(),skew(),rotate-deg(),rotate()
11,2,Which property is used to apply an animation?,animation,transition,animation-name,animation-timing-function,animation
11,2,Which unit represents a percentage of the containing block's width?,vw,px,em,rem,vw
11,2,How do you add rounded corners to an element?,border-radius,border-style,border-width,border-color,border-radius
11,2,Which CSS property allows you to hide an element without removing it from the document?,visibility,display,opacity,z-index,visibility
11,2,Which CSS property sets the transparency of an element?,opacity,visibility,transparent,display,opacity
11,2,What does the float property do?,It moves an element to the left or right of its container.,It sets the position of the element.,It controls the overflow of elements.,It clears the positioning of floated elements.,It moves an element to the left or right of its container.
11,2,Which CSS property specifies whether the text of an element is capitalized?,text-transform,text-decoration,text-align,font-style,text-transform
11,2,Which CSS rule is used to define media queries?,@media,@query,@import,@mediaquery,@media
11,2,Which CSS property defines the spacing between lines of text?,line-height,letter-spacing,word-spacing,text-indent,line-height
11,2,How do you make text bold in CSS?,font-weight:bold;font-style:bold;text-align:bold;text-transform:bold;font-weight:bold;
11,2,Which CSS pseudo-class targets the first child element of its parent?,:first-child,:nth-child,:first,:last-child,:first-child
11,2,Which property is used to control the visibility of the scrollbar?,overflow,scrollbar,scroll-behavior,overflow-x,overflow
11,2,Which of the following is a valid CSS flexbox property?,justify-content,align-text,text-align,float,justify-content
11,2,What is the correct way to apply a CSS transition?,transition:property duration ease;,transition-duration:,transition-effect:,transition-style:,transition:property duration ease;
11,2,How do you create a linear gradient in CSS?,linear-gradient(),gradient(),background-gradient(),create-gradient(),linear-gradient()
11,2,Which property can be used to add shadow to text?,text-shadow,box-shadow,shadow,drop-shadow,text-shadow
11,2,Which CSS property is used to control the space between list items?,list-style-position,list-spacing,list-gap,margin,list-style-position
11,2,How do you select elements with a specific class in CSS?,.classname,#classname,class=classname,@classname,.classname
11,2,Which of the following is the default display property for div elements?,block,inline,inline-block,flex,block
11,2,What does the CSS box-sizing property control?,How the total width and height of an element is calculated.,The size of the element's content.,The element's padding and margin.,The element's display type.,How the total width and height of an element is calculated.
11,2,Which CSS property specifies the stacking order of elements?,z-index,order,stack,position,z-index
11,2,How do you set a CSS rule for hover state?,:hover,:onhover,:mouseover,:hovered,:hover
11,2,Which property is used to define how content overflows an element?,overflow,flow,content-overflow,display-overflow,overflow
11,2,Which CSS property is used to create a gap between columns in a grid layout?,grid-column-gap,column-gap,gap,grid-gap,column-gap
11,2,Which CSS property specifies how an element's content should be clipped?,clip,cut,hide,overflow,clip
11,2,Which CSS property is used to apply a shadow to an element's box?,box-shadow,shadow,element-shadow,drop-shadow,box-shadow
11,2,Which value of the display property hides an element but does not remove it from the document flow?,none,hidden,block,inline,none
11,2,How do you apply a specific font in CSS?,font-family:,font-style:,font-weight:,text-style:,font-family:
11,2,What is the default value of the flex-direction property in CSS Flexbox?,row,column,row-reverse,column-reverse,row
11,2,Which CSS property specifies the speed curve of an animation?,animation-timing-function,animation-duration,animation-delay,animation-direction,animation-timing-function
11,2,Which property sets the space between characters in text?,letter-spacing,word-spacing,line-height,text-spacing,letter-spacing
11,2,How do you make an image responsive using CSS?,max-width:100%;,width:auto;,display:block;,height:auto;,max-width:100%;
11,2,Which CSS property is used to define the width of the border?,border-width,border-style,border-size,border-thickness,border-width
11,2,How do you hide an element in CSS?,display:none;,visibility:hide;,opacity:0;,z-index:-1;,display:none;
11,2,What is the default value of the flex-wrap property in CSS Flexbox?,nowrap,wrap,wrap-reverse,no-wrap,nowrap
11,2,How do you apply styles to an element only when it is in focus?,:focus,:active,:hover,:checked,:focus
11,2,Which CSS property is used to add a shadow to an element?,box-shadow,text-shadow,element-shadow,outline-shadow,box-shadow
11,2,What does the clear property in CSS do?,It specifies which sides of an element cannot be adjacent to floating elements.,It hides the element.,It clears the element's content.,It clears the element's style.,It specifies which sides of an element cannot be adjacent to floating elements.
11,2,Which CSS property is used to specify the alignment of items in a flex container?,align-items,justify-content,align-content,align-self,align-items
11,2,Which CSS property specifies the height of an element?,height,max-height,min-height,line-height,height
11,2,What is the purpose of the CSS z-index property?,It defines the stack order of elements.,It controls the zoom level of an element.,It adjusts the opacity of an element.,It defines the distance between an element and its container.,It defines the stack order of elements.
11,2,Which CSS property is used to create space between the content and the border of an element?,padding,margin,spacing,content-padding,padding
11,2,Which CSS property controls the space between words in a text?,word-spacing,letter-spacing,line-height,text-spacing,word-spacing
11,2,Which CSS property is used to make the text italic?,font-style:italic;,text-decoration:italic;,font-weight:italic;,font-variant:italic;,font-style:italic;
11,2,How do you target an element by its ID in CSS?,#elementid,.elementid,elementid,element-id,#elementid
11,2,Which CSS property is used to define the thickness of text?,font-weight,font-style,text-thickness,text-weight,font-weight
11,2,How do you specify the amount of space between the border and content?,padding,border-margin,content-margin,margin,padding
11,2,Which CSS property is used to create a space between list items?,list-style-position,list-gap,list-spacing,list-item-space,list-style-position
11,2,How do you create a comment in CSS?,/* comment */,// comment ,<!-- comment -->,<!-- comment */,/* comment */
11,2,Which property is used to add space between the border and the edge of an element?,margin,padding,border-spacing,border-margin,margin
11,2,Which CSS property specifies the stack order of elements?,z-index,stack-order,layer-order,element-index,z-index
11,2,Which CSS property is used to define a transition effect?,transition,animation,transformation,transform,transition
11,2,What is the correct syntax for a CSS rule?,selector { property: value; },selector { value: property; },property { selector: value; },selector { value = property; },selector { property: value; }
11,2,Which CSS property is used to define how an element behaves when it overflows its container?,overflow,flow,display-overflow,clip,overflow
11,2,Which CSS property is used to change the font size of text?,font-size,text-size,font-weight,text-height,font-size
11,2,What is the default value of the display property?,block,inline,inline-block,none,block
11,2,Which property is used to add space around an element's content?,padding,margin,border,spacing,padding
11,2,Which CSS property is used to align flex container elements horizontally?,justify-content,align-content,align-items,align-self,justify-content
11,2,Which CSS property is used to add a border to an element?,border,border-width,border-style,border-color,border
11,2,What does the CSS rule overflow:auto; do?,It adds scrollbars when needed.,It hides the overflow content.,It displays all content.,It clips the overflow content.,It adds scrollbars when needed.
11,2,Which CSS property is used to control the stacking order of positioned elements?,z-index,order,stack-index,stack-order,z-index
11,2,How do you add an external CSS file to a webpage?,<link rel=stylesheet href=style.css>,<link src=style.css>,<style src=style.css>,<link stylesheet=style.css>,<link rel=stylesheet href=style.css>
11,2,Which CSS property is used to control the visibility of an element?,visibility,display,opacity,show,visibility
11,2,What is the default value of the flex-wrap property in a flex container?,nowrap,wrap,wrap-reverse,no-wrap,nowrap
11,2,Which CSS property defines the behavior of the background image?,background-repeat,background-clip,background-size,background-origin,background-repeat
11,2,How do you target an element by its class in CSS?,.classname,#classname,@classname,class=classname,.classname
11,2,Which CSS property specifies the amount of space inside the border of an element?,padding,margin,border-spacing,border-padding,padding
11,2,How do you specify a font in CSS?,font-family:Arial;,text-font:Arial;,font:Arial;,text-family:Arial;,font-family:Arial;
11,2,Which CSS property defines the width of an element's border?,border-width,border-thickness,border-size,border-height,border-width
11,2,What is the correct way to apply a linear gradient as a background in CSS?,background: linear-gradient(),background-gradient:,background-color: gradient(),gradient: background(),background: linear-gradient()
11,2,Which CSS property is used to specify the alignment of flex items in a container?,align-items,justify-content,align-content,align-self,align-items
11,2,Which CSS property is used to specify the width of an element?,width,max-width,min-width,element-width,width
11,2,Which property would you use to change the color of text in CSS?,color,font-color,background-color,text-color,color
11,2,Which CSS property is used to create a flexible layout?,flexbox,grid,table,block,flexbox
11,2,Which property is used to set the maximum width of an element?,max-width,min-width,width-limit,width,max-width
11,2,How do you apply multiple background images to an element?,background-image:url('image1'), url('image2'),background:url('image1'), url('image2'),background:url['image1'], url['image2'],background:url['image1'] 'image2',background-image:url('image1'), url('image2')
11,2,Which CSS property can be used to hide overflow content and add scrollbars if needed?,overflow:auto,overflow:hidden,overflow:scroll,overflow-x:visible,overflow:auto
11,2,Which CSS property is used to create a gap between grid items?,grid-gap,grid-margin,grid-padding,grid-space,grid-gap
11,2,How can you apply a rule to multiple selectors?,Separate each selector with a comma,Separate each selector with a semicolon,Use the @import rule,Use the @include directive,Separate each selector with a comma
11,2,What is the default value of the flex-grow property?,0,1,auto,none,0
11,2,Which CSS property is used to control how a block element is aligned horizontally?,margin:auto,align:auto,justify-content:center,position:absolute,margin:auto
11,2,Which CSS property is used to change the cursor to a hand when hovering over an element?,cursor:pointer,hover:pointer,cursor:hand,hover:hand,cursor:pointer
11,2,Which CSS property defines the space outside the element's border?,margin,padding,border-width,box-sizing,margin
11,2,Which CSS pseudo-class is used to style an element when it gets focus?,:focus,:hover,:active,:checked,:focus
11,2,Which CSS property controls the order in which flex items appear?,order,align-items,justify-content,z-index,order
11,2,How do you remove the underline from a hyperlink in CSS?,text-decoration:none;text-style:none;,border:none;,list-style:none;,text-decoration:none;
11,2,Which property would you use to make a font italic in CSS?,font-style:italic;,font-weight:italic;,text-style:italic;,font:italic;,font-style:italic;
11,2,Which property is used to set an element's width to fit the container?,width:100%,max-width:fit-content;,display:block;,flex-basis:100%,width:100%
11,2,How can you force an element to be on a new line?,display:block;,position:relative;,float:left;,clear:left;,display:block;
11,2,Which CSS property changes the style of a list marker?,list-style-type,list-style-image,list-style-position,marker-type,list-style-type
11,2,Which property controls the appearance of a border’s corners?,border-radius,border-width,border-style,corner-style,border-radius
11,2,How do you vertically center content within a flex container?,align-items:center;,vertical-align:center;,justify-content:center;,align-content:center;,align-items:center;
11,2,Which CSS property allows you to control the space between columns in a multi-column layout?,column-gap,column-space,column-width,column-margin,column-gap
11,2,Which property would you use to adjust the height of an element?,height,max-height,min-height,line-height,height
11,2,What does the CSS rule overflow:hidden do?,It hides any content that overflows the container.,It adds scrollbars.,It clears the overflow.,It displays the overflowed content.,It hides any content that overflows the container.
11,2,How do you define a CSS grid container?,display:grid;,grid-template:,grid-layout:,grid-system:,display:grid;
11,2,Which property defines the amount of space inside the border of an element?,padding,margin,border-gap,spacing,padding
11,2,Which CSS property changes the background of an element?,background-color,background-image,background-position,color,background-color
11,2,Which value of the position property positions an element relative to its first positioned ancestor?,absolute,relative,fixed,static,absolute
11,2,Which CSS property controls the space between words?,word-spacing,letter-spacing,spacing,line-spacing,word-spacing
11,2,How do you add a background image to an element in CSS?,background-image:url(image.png);,background:url(image.png);,background-color:url(image.png);,background:img(image.png);,background-image:url(image.png);
11,2,Which property specifies the horizontal alignment of block elements?,text-align,justify-content,vertical-align,align-items,text-align
11,2,How do you add space between the border and the content of a button?,padding,margin,spacing,content-spacing,padding
11,2,Which CSS property is used to define the space between the lines of text?,line-height,letter-spacing,word-spacing,text-indent,line-height
11,2,Which CSS property is used to transform elements along the x-axis or y-axis?,transform,rotate,translate,scale,transform
11,2,Which CSS property controls how an image or background repeats?,background-repeat,background-position,background-size,background-clip,background-repeat
11,2,Which CSS property is used to control the visibility of an element?,visibility,display,opacity,visibility-style,visibility
11,2,Which CSS property is used to make a responsive layout?,media queries,grid,container,display:block,media queries
11,2,What is the purpose of the :nth-child(n) selector in CSS?,It selects elements based on their position in a parent element.,It selects the last child.,It selects the nth last child.,It selects the nth element of a specific class.,It selects elements based on their position in a parent element.
11,2,Which property would you use to add space between the letters of text?,letter-spacing,word-spacing,line-spacing,space-between,letter-spacing
11,2,Which property controls the space inside the border of a table cell?,padding,margin,border-spacing,cell-padding,padding
11,2,Which property would you use to prevent text from wrapping?,white-space:nowrap;,text-overflow:clip;,overflow-x:visible;,display:nowrap;,white-space:nowrap;
11,2,Which CSS property sets the background image position?,background-position,background-image,background-align,background-clip,background-position
11,2,Which value of the display property creates a flexible container for layout purposes?,flex,inline-block,block,table,flex
11,2,Which property controls the shadow around an element in CSS?,box-shadow,text-shadow,shadow,drop-shadow,box-shadow
11,2,How do you apply a border to only the top side of an element?,border-top:,border:,border-width:,border-top-style:,border-top:
11,2,Which CSS property is used to change the color of a border?,border-color,border-style,border-width,border-shade,border-color
11,2,Which property is used to specify whether an element should float to the left or right of its container?,float,position,align,justify,float
11,2,Which CSS pseudo-class is used to style an element when a user mouses over it?,:hover,:focus,:active,:selected,:hover
11,2,Which CSS property allows you to control the space around images?,margin,padding,border,outline,margin
11,2,Which CSS property would you use to control the order of grid items?,grid-template-order,grid-row-order,grid-area,grid-row,grid-area
11,2,What is the default behavior of the float property?,It allows elements to float to the left or right.,It centers an element.,It makes the element hidden.,It expands the width of the element.,It allows elements to float to the left or right.
11,2,How do you ensure that an element's padding and border are included in the element's total width and height?,box-sizing:border-box;,display:block;,width:100%;,height:auto;,box-sizing:border-box;
11,2,Which CSS property controls the background color of a table?,background-color,table-background-color,table-color,table-background,background-color
11,2,Which value of the position property is used to place an element relative to the viewport?,fixed,absolute,static,relative,fixed
11,2,What is the purpose of the z-index property?,It controls the stack order of overlapping elements.,It sets the zoom level.,It adjusts the height of elements.,It sets the visibility of elements.,It controls the stack order of overlapping elements.
11,2,Which CSS property would you use to control the size of an element's shadow?,box-shadow,shadow-size,shadow,outline,box-shadow
11,2,Which CSS property can hide an element without removing it from the layout?,visibility:hidden;,display:none;,opacity:0;,z-index:-1;,visibility:hidden;
11,2,Which property controls the space between columns in a multi-column layout?,column-gap,column-spacing,column-margin,column-padding,column-gap
11,2,Which CSS property is used to create a grid-based layout?,display:grid;,grid-template:,grid-columns:,grid-layout:,display:grid;
11,2,Which CSS property is used to control the space between inline elements?,word-spacing,letter-spacing,line-spacing,element-spacing,word-spacing
11,2,What does the CSS property font-variant do?,It controls the font's small-caps effect.,It changes the font size.,It controls the font style.,It adds emphasis to text.,It controls the font's small-caps effect.
11,2,Which CSS property would you use to make an element completely invisible?,display:none;,visibility:hidden;,opacity:0;,z-index:0;,display:none;
11,2,Which property would you use to limit how wide an element can be?,max-width,width,margin-left,min-width,max-width
11,2,Which property is used to set the layout of a table's rows and columns?,table-layout:,display:table;,row-column;,grid;,table-layout:
11,2,Which CSS property sets the alignment of flex items along the main axis?,justify-content,align-items,align-content,align-self,justify-content
11,2,What is the default value of the flex-direction property?,row,column,row-reverse,column-reverse,row
11,2,Which CSS property is used to control the direction of the flex container's main axis?,flex-direction,align-items,justify-content,align-self,flex-direction
11,2,Which CSS property is used to change the style of a list marker?,list-style-type:,list-type:,marker-type:,marker-style:,list-style-type:
11,2,Which property allows you to control the number of columns in a multi-column layout?,column-count,column-gap,column-width,column-span,column-count
11,2,Which CSS property is used to create space between grid rows?,grid-row-gap,grid-gap,row-gap,column-gap,grid-row-gap
11,2,Which CSS property defines the transparency level of an element?,opacity,visibility,display,transparency,opacity
11,2,What is the initial value of the position property in CSS?,static,relative,absolute,fixed,static
11,2,Which CSS property controls the font size?,font-size,text-size,font-style,text-style,font-size
11,2,How do you make an element take up the full width of the viewport?,width:100vw;,width:full;,width:auto;,min-width:100vw;,width:100vw;
11,2,Which CSS property is used to control the space between the content and the border of an element?,padding,margin,border-spacing,content-spacing,padding
11,2,What does the background-attachment property control?,Whether a background image scrolls with the page or stays fixed.,The position of the background image.,The size of the background image.,The visibility of the background image.,Whether a background image scrolls with the page or stays fixed.
11,2,Which CSS property is used to create rounded borders?,border-radius,round-border,border-style,border-corner,border-radius
11,2,Which CSS property is used to apply shadows to text?,text-shadow,font-shadow,text-outline,shadow-style,text-shadow
11,2,Which CSS property controls the appearance of a block element?,display,visibility,block-size,flex-direction,display
11,2,How do you center text inside a block element?,text-align:center;,align:center;,justify-content:center;,display:block;,text-align:center;
11,2,Which property is used to set the amount of space between the border and the edge of an element?,padding,margin,spacing,border-gap,padding
11,2,Which CSS property is used to control the space between the content and the edge of a table cell?,padding,cell-padding,border-spacing,cell-spacing,padding
11,2,What does the z-index property do in CSS?,Controls the stacking order of elements,Sets the opacity of elements,Controls the visibility of elements,Changes the size of elements,Controls the stacking order of elements
11,2,Which CSS property allows text to overflow into an ellipsis (...)? ,text-overflow:text-ellipsis;,text-overflow:ellipsis;,overflow:hidden;,overflow:auto;,text-overflow:ellipsis;
11,2,Which property controls whether an element's children appear in front or behind their parent?,z-index,display,position,float,z-index
11,2,What is the purpose of the :before pseudo-element in CSS?,It inserts content before an element.,It replaces an element with new content.,It adds a class to an element.,It hides an element.,It inserts content before an element.
11,2,Which property is used to create a grid layout in CSS?,display:grid;,grid-template-rows:grid;,layout:grid;,block-grid;,display:grid;
11,2,How do you change the color of a hyperlink when it is hovered over?,a:hover { color:red; },a:active { color:red; },a:link { color:red; },a:visited { color:red; },a:hover { color:red; }
11,2,Which property defines the space between flex items?,gap,flex-gap,grid-gap,spacing-gap,gap
11,2,Which CSS property controls the height of an element?,height,max-height,line-height,width,height
11,2,Which value of the position property keeps an element fixed in place, even when scrolling?,fixed,absolute,relative,static,fixed
11,2,What is the default value of the display property?,block,inline,flex,none,block
11,2,Which CSS property is used to create space between columns in a multi-column layout?,column-gap,column-padding,column-space,column-width,column-gap
11,2,Which property defines how a flex container's children will align along the cross axis?,align-items,justify-content,align-self,flex-wrap,align-items
11,2,What does the CSS rule display:none do?,Hides an element from view and removes it from the layout.,Makes an element invisible but keeps it in the layout.,Adds padding to the element.,Centers an element on the page.,Hides an element from view and removes it from the layout.
11,2,Which CSS property is used to define an element's opacity?,opacity,visibility,display,transparency,opacity
11,2,How do you create a border around a table in CSS?,border:1px solid black;,outline:1px solid black;,padding:1px solid black;,margin:1px solid black;,border:1px solid black;
11,2,Which value of the position property allows an element to move relative to its normal position?,relative,absolute,fixed,static,relative
11,2,What is the default value of the overflow property?,visible,hidden,scroll,auto,visible
11,2,Which property defines the alignment of items along the main axis in a flex container?,justify-content,align-content,align-items,align-self,justify-content
11,2,Which CSS property is used to set the background size?,background-size,background-position,background-repeat,background-clip,background-size
