tech_id,level_id,question_text,option_a,option_b,option_c,option_d,correct_option
11,2,What is the purpose of the `grid-template-columns` property?,It defines the column sizes for a grid layout.,It sets the number of columns in a grid.,It controls the row heights in a grid.,It adjusts the gap between grid items.,It defines the column sizes for a grid layout.
11,2,How can you make a button look like a link?,border: none; background: none; color: inherit;,display: inline-block; border: none; background: none;,text-decoration: none; background: none;,display: inline; color: inherit;,border: none; background: none; color: inherit.
11,2,What is the purpose of the `flex-grow` property?,It defines how much a flex item will grow relative to the rest of the flex items.,It sets the size of a flex container.,It adjusts the alignment of flex items.,It defines the order of flex items.,It defines how much a flex item will grow relative to the rest of the flex items.
11,2,How do you set a background image in CSS?,background-image: url('image-url');,background: image('image-url');,bg-image: url('image-url');,image-background: url('image-url');,background-image: url('image-url');
11,2,What does the `float` property do in CSS?,It allows an element to float to the left or right of its container.,It controls the stacking order of elements.,It adjusts the margin of an element.,It defines the size of an element.,It allows an element to float to the left or right of its container.
11,2,How can you create a sticky header using CSS?,position: sticky; top: 0;,position: fixed; top: 0;,position: relative; top: 0;,position: absolute; top: 0;,position: sticky; top: 0;
11,2,What is the purpose of the `display: flex;` property?,It enables a flexbox layout for an element.,It sets the display type of an element.,It makes an element inline.,It adjusts the size of an element.,It enables a flexbox layout for an element.
11,2,How do you change the font size in CSS?,font-size: value;,set-font-size: value;,font: size value;,size: font value;,font-size: value;
11,2,What does the `@media` rule do in CSS?,It applies styles based on device characteristics.,It sets the background color of an element.,It adjusts the margin of an element.,It defines a media type.,It applies styles based on device characteristics.
11,2,How can you make text bold in CSS?,font-weight: bold;,font: bold;,text-weight: bold;,text-style: bold;,font-weight: bold;
11,2,What is the purpose of the `grid-template-rows` property?,It defines the row sizes for a grid layout.,It sets the number of rows in a grid.,It controls the column widths in a grid.,It adjusts the gap between grid items.,It defines the row sizes for a grid layout.
11,2,How do you create a flex container in CSS?,display: flex;,flex-container: true;,container: flex;,flex: container;,display: flex;
11,2,What does the `visibility` property do in CSS?,It controls the visibility of an element.,It hides an element while retaining its space.,It sets the opacity of an element.,It adjusts the size of an element.,It controls the visibility of an element.
11,2,How can you set multiple background images in CSS?,background: url('image1'), url('image2');,background-image: url('image1'), url('image2');,background: images('image1', 'image2');,background-image: url('image1') url('image2');,background: url('image1'), url('image2');
11,2,What is the purpose of the `transform` property in CSS?,It allows you to rotate, scale, skew, or translate an element.,It defines the size of an element.,It adjusts the margin of an element.,It sets the opacity of an element.,It allows you to rotate, scale, skew, or translate an element.
11,2,How do you make an element invisible but keep its space?,visibility: hidden;,display: none;,opacity: 0;,background: none;,visibility: hidden;
11,2,What does the `nth-child` selector do in CSS?,It selects elements based on their order in the parent.,It targets elements of a specific class.,It applies styles to all children of an element.,It selects elements with a specific attribute.,It selects elements based on their order in the parent.
11,2,How can you set a box shadow in CSS?,box-shadow: value;,shadow: value;,set-shadow: value;,border-shadow: value;,box-shadow: value;
11,2,What is the purpose of the `justify-content` property in CSS Flexbox?,It aligns flex items along the main axis.,It sets the size of flex items.,It controls the order of flex items.,It adjusts the spacing between flex items.,It aligns flex items along the main axis.

